{
  "$schema": "https://json-schema.org/draft/2020-12/schema",
  "$id": "https://zyzhixi.github.io/MediaFontsPacked/schema/manifest.schema.json",
  "title": "MFP manifest",
  "description": ".mfp 容器的索引文件 manifest.json 的结构定义，对应 SPEC.md 第 4 章与 10.4 节",
  "type": "object",
  "required": ["mfpVersion", "formatVersion", "revision", "fonts", "checksum"],
  "additionalProperties": true,
  "properties": {
    "mfpVersion": { "type": "string", "pattern": "^\\d+\\.\\d+\\.\\d+$" },
    "formatVersion": { "type": "integer", "minimum": 1 },
    "revision": { "type": "integer", "minimum": 1 },
    "parentRevision": { "type": ["integer", "null"], "minimum": 1 },
    "createdAt": { "type": "string", "format": "date-time" },
    "updatedAt": { "type": "string", "format": "date-time" },
    "operation": { "enum": ["create", "addFont", "removeFont", "updateMetadata", "compact"] },
    "changes": {
      "type": "object",
      "additionalProperties": true,
      "properties": {
        "added": { "type": "array", "items": { "type": "string" } },
        "removed": { "type": "array", "items": { "type": "string" } },
        "modified": { "type": "array", "items": { "type": "string" } },
        "compacted": { "type": "boolean" }
      }
    },
    "package": {
      "type": "object",
      "required": ["id", "name", "version"],
      "additionalProperties": true,
      "properties": {
        "id": { "type": "string", "minLength": 1 },
        "name": { "type": "string", "minLength": 1 },
        "description": { "type": "string" },
        "version": { "type": "string", "minLength": 1 },
        "cover": { "type": "string" },
        "screenshots": { "type": "array", "items": { "type": "string" } },
        "icon": { "type": "string" },
        "eula": { "type": "string" },
        "allowRedistribution": { "type": "boolean", "default": false },
        "tags": { "type": "array", "items": { "type": "string" } }
      }
    },
    "fonts": {
      "type": "array",
      "minItems": 1,
      "items": {
        "type": "object",
        "required": ["id", "hash", "file", "format", "isCollection", "faceCount", "installMode", "metadata"],
        "additionalProperties": true,
        "properties": {
          "id": { "type": "string", "minLength": 1 },
          "hash": { "type": "string", "pattern": "^sha256:[0-9a-f]{64}$" },
          "file": { "type": "string", "pattern": "^fonts/[0-9a-f]{64}\\.(ttf|otf|ttc|otc|woff|woff2)$" },
          "originalName": { "type": "string" },
          "format": { "enum": ["ttf", "otf", "ttc", "otc", "woff", "woff2"] },
          "isCollection": { "type": "boolean" },
          "faceCount": { "type": "integer", "minimum": 1 },
          "installMode": { "enum": ["singleFace", "allFaces"] },
          "faces": {
            "type": "array",
            "items": {
              "type": "object",
              "required": ["faceIndex", "postscriptName", "familyName", "subfamilyName"],
              "additionalProperties": true,
              "properties": {
                "faceIndex": { "type": "integer", "minimum": 0 },
                "postscriptName": { "type": "string" },
                "familyName": { "type": "string" },
                "subfamilyName": { "type": "string" },
                "version": { "type": "string" },
                "characterSet": {
                  "type": "object",
                  "additionalProperties": true,
                  "properties": {
                    "unicodeRanges": { "type": "array", "items": { "type": "string" } },
                    "glyphCount": { "type": "integer", "minimum": 0 }
                  }
                },
                "variationAxes": { "type": ["object", "null"] },
                "colorTables": { "type": "array", "items": { "type": "string" } }
              }
            }
          },
          "metadata": {
            "type": "object",
            "required": ["familyName", "subfamilyName", "postscriptName", "fullName"],
            "additionalProperties": true,
            "properties": {
              "familyName": { "type": "string" },
              "subfamilyName": { "type": "string" },
              "postscriptName": { "type": "string" },
              "fullName": { "type": "string" },
              "version": { "type": "string" },
              "copyright": { "type": "string" },
              "designer": { "type": "string" },
              "designerURL": { "type": "string" },
              "license": { "type": "string" },
              "licenseURL": { "type": "string" },
              "characterSet": {
                "type": "object",
                "additionalProperties": true,
                "properties": {
                  "unicodeRanges": { "type": "array", "items": { "type": "string" } },
                  "glyphCount": { "type": "integer", "minimum": 0 }
                }
              },
              "variationAxes": { "type": ["object", "null"] },
              "colorTables": { "type": "array", "items": { "type": "string" } },
              "availableFormats": { "type": "array", "items": { "type": "string" } },
              "woff2File": { "type": "string" }
            }
          },
          "preview": {
            "type": "object",
            "additionalProperties": true,
            "properties": {
              "image": { "type": "string" },
              "templateId": { "type": "string" },
              "generatedText": { "type": "string" },
              "source": { "enum": ["user", "generated", "embedded", "fallback"] }
            }
          },
          "license": {
            "type": "object",
            "additionalProperties": true,
            "properties": {
              "type": { "type": "string" },
              "file": { "type": "string" },
              "allowRedistribution": { "type": "boolean" },
              "allowCommercial": { "type": "boolean" },
              "allowModification": { "type": "boolean" }
            }
          }
        }
      }
    },
    "templates": {
      "type": "array",
      "items": {
        "type": "object",
        "required": ["id", "name", "file"],
        "additionalProperties": true,
        "properties": {
          "id": { "type": "string", "minLength": 1 },
          "name": { "type": "string", "minLength": 1 },
          "isDefault": { "type": "boolean" },
          "file": { "type": "string", "pattern": "^templates/.+\\.json$" }
        }
      }
    },
    "conflicts": {
      "type": "object",
      "additionalProperties": true,
      "properties": {
        "duplicates": { "$ref": "#/$defs/conflictList" },
        "versionConflicts": { "$ref": "#/$defs/conflictList" },
        "nameConflicts": { "$ref": "#/$defs/conflictList" },
        "formatDuplicates": { "$ref": "#/$defs/conflictList" }
      }
    },
    "storage": {
      "type": "object",
      "additionalProperties": true,
      "properties": {
        "garbageBytes": { "type": "integer", "minimum": 0 },
        "garbageRatio": { "type": "number", "minimum": 0, "maximum": 1 },
        "compactionThreshold": { "type": "number", "minimum": 0.05, "maximum": 0.5 },
        "lastCompactionRevision": { "type": "integer", "minimum": 0 },
        "entryCount": { "type": "integer", "minimum": 0 },
        "liveEntryCount": { "type": "integer", "minimum": 0 }
      }
    },
    "checksum": {
      "type": "object",
      "required": ["algorithm", "manifestHash", "entries"],
      "additionalProperties": true,
      "properties": {
        "algorithm": { "enum": ["sha256"] },
        "manifestHash": { "type": "string" },
        "entries": {
          "type": "object",
          "additionalProperties": { "type": "string" }
        }
      }
    },
    "recovery": {
      "type": "object",
      "required": ["present", "coveredRange", "length"],
      "additionalProperties": true,
      "properties": {
        "present": { "type": "boolean" },
        "method": { "type": "string" },
        "coveredRange": {
          "enum": ["central-directory", "manifest", "central-directory+manifest", "full"]
        },
        "length": { "type": "integer", "minimum": 0 }
      }
    }
  },
  "$defs": {
    "conflictList": {
      "type": "array",
      "items": {
        "type": "object",
        "required": ["fontId", "type"],
        "additionalProperties": true,
        "properties": {
          "fontId": { "type": "string" },
          "duplicateOf": { "type": "string" },
          "conflictsWith": { "type": "string" },
          "type": { "enum": ["exact", "version", "name", "format"] }
        }
      }
    }
  }
}
